"","DOI","Title","Authors","Author_Affiliations","Correspondence_Author","Correspondence_Author_Email","Publication_Date","Keywords","Abstract","Full_Text"
"20","10.1093/dnares/7.3.175","A Large Scale Analysis of cDNA in Arabidopsis thaliana : Generation of 12,028 Non-redundant Expressed Sequence Tags from Normalized and Size-selected cDNA Libraries","Erika Asamizu,Yasukazu Nakamura,Shusei Sato,Satoshi Tabata","NO","NO","NO","01 June 2000","Arabidopsis thaliana, cDNA, EST"," For comprehensive analysis of genes expressed in the model dicotyledonous plant, Arabidopsis thaliana , expressed sequence tags (ESTs) were accumulated. Normalized and size-selected cDNA libraries were constructed from aboveground organs, flower buds, roots, green siliques and liquid-cultured seedlings, respectively, and a total of 14,026 5′-end ESTs and 39,207 3′-end ESTs were obtained. The 3′-end ESTs could be clustered into 12,028 non-redundant groups. Similarity search of the non-redundant ESTs against the public non-redundant protein database indicated that 4816 groups show similarity to genes of known function, 1864 to hypotheticalgenes, and the remaining 5348 are novel sequences. Gene coverage by the non-redundant ESTs was analyzed using the annotated genomic sequences of approximately 10 Mb on chromosomes 3 and 5. A total of 923 regions were hit by at least one EST, among which only 499 regions were hit by the ESTs deposited in the public database. The result indicates that the EST source generated in this project complements the EST data in the public database and facilitates new gene discovery. The EST sequence data of individual cDNA clones are available at the web site: Author Webpage . "," For comprehensive analysis of genes expressed in the model dicotyledonous plant, Arabidopsis thaliana , expressed sequence tags (ESTs) were accumulated. Normalized and size-selected cDNA libraries were constructed from aboveground organs, flower buds, roots, green siliques and liquid-cultured seedlings, respectively, and a total of 14,026 5′-end ESTs and 39,207 3′-end ESTs were obtained. The 3′-end ESTs could be clustered into 12,028 non-redundant groups. Similarity search of the non-redundant ESTs against the public non-redundant protein database indicated that 4816 groups show similarity to genes of known function, 1864 to hypotheticalgenes, and the remaining 5348 are novel sequences. Gene coverage by the non-redundant ESTs was analyzed using the annotated genomic sequences of approximately 10 Mb on chromosomes 3 and 5. A total of 923 regions were hit by at least one EST, among which only 499 regions were hit by the ESTs deposited in the public database. The result indicates that the EST source generated in this project complements the EST data in the public database and facilitates new gene discovery. The EST sequence data of individual cDNA clones are available at the web site: Author Webpage . "
"21","10.1093/dnares/7.3.181","Cbfa1 , an Essential Transcription Factor for Bone Formation, Is Expressed in Testis from the Same Promoter Used in Bone","Shinji Ogawa,Hideyuki Harada,Masanori Fujiwara,Shuzo Tagashira,Takashi Katsumata,Hiroshi Takada","NO","NO","NO","01 June 2000","Cbfa1, Pebp2αA, AML3, testis, promoter"," Cbfa1 is an essential transcription factor for bone formation, but its transcripts have also been detected in thymus and testis. To elucidate the expression of Cbfa1 in testis, we isolated Cbfa1 cDNA from mouse testis. First we examined the length of the transcripts expressed in mouse testis by Northern hybridization. Using a cDNA probe that can detect both Type-I and Type-II Cbfa1 (Type-I: originally reported as Pebp2αA by Ogawa et al 1 ; Type-II: originally reported as til-1 by Stewart et al 2 ), 1.8-kb transcripts were detected in testis, and larger transcripts (6.3 kb and 7.4 kb) in T-cell lines, thymus and bone. Using a Type-II specific probe (bone isoform-specific probe), surprisingly, 1.8-kb testis transcript(s) were detected as well as those (6.3 kb) found in bone. In addition, the transcription start site in mouse testis coincides with one of three start sites identified in bone. These results suggest that the testis transcript is generated from the same promoter of Type-II Cbfa1 , which is thought to be active only in osteoblasts and some chondrocytes. Next, to define the difference in length of transcripts, we isolated the Cbfa1 cDNA from mouse testis. Sequence analysis of the cDNA showed that alternative splicing around exon 2 and poly-adenylation within exon 8 occurred in the testis isoform, which produce the smaller transcripts. These data revealed that testis Cbfa1 mRNA is transcribed from same promoter used in bones, but the post-transcriptional regulation is different between testis and skeletal tissues. "," Cbfa1 is an essential transcription factor for bone formation, but its transcripts have also been detected in thymus and testis. To elucidate the expression of Cbfa1 in testis, we isolated Cbfa1 cDNA from mouse testis. First we examined the length of the transcripts expressed in mouse testis by Northern hybridization. Using a cDNA probe that can detect both Type-I and Type-II Cbfa1 (Type-I: originally reported as Pebp2αA by Ogawa et al 1 ; Type-II: originally reported as til-1 by Stewart et al 2 ), 1.8-kb transcripts were detected in testis, and larger transcripts (6.3 kb and 7.4 kb) in T-cell lines, thymus and bone. Using a Type-II specific probe (bone isoform-specific probe), surprisingly, 1.8-kb testis transcript(s) were detected as well as those (6.3 kb) found in bone. In addition, the transcription start site in mouse testis coincides with one of three start sites identified in bone. These results suggest that the testis transcript is generated from the same promoter of Type-II Cbfa1 , which is thought to be active only in osteoblasts and some chondrocytes. Next, to define the difference in length of transcripts, we isolated the Cbfa1 cDNA from mouse testis. Sequence analysis of the cDNA showed that alternative splicing around exon 2 and poly-adenylation within exon 8 occurred in the testis isoform, which produce the smaller transcripts. These data revealed that testis Cbfa1 mRNA is transcribed from same promoter used in bones, but the post-transcriptional regulation is different between testis and skeletal tissues. "
"22","10.1093/dnares/7.3.187","Isolation and Characterization of the Gene Encoding Mouse Tax-Responsive Element-Binding Protein (TREB) 5","Tamotsu Masaki,Hajime Noguchi,Masaaki Kobayashi,Mitsuaki Yoshida,Ken Takamatsu","NO","NO","NO","01 June 2000","transcription factor, b-zip, gene, sequence, promoter"," TREB5/hXBP-1/HTF is a basic region leucine zipper protein which binds to a cyclic AMP responsive element (CRE)-like element in both human T-cell leukemia virus type 1 and human major histocompatibility complex (MHC) class II genes. To analyze the structure and transcription regulation of the TREB5 gene, we isolated the mouse TREB5 gene and cDNA. The mouse TREB5 gene contains five exons and four introns and spans approximately 5 kb. The deduced amino acid sequence of mouse TREB5 exhibited 77% and 94% homology to human and rat TREB5, respectively. The b-zip structure is completely conserved in mouse, rat and human. Southern blot analysis of the mouse genomic DNA demonstrated that positive bands exactly coincide with those expected from sequences of the cloned genes, indicating that the mouse TREB5 gene is present as a single copy. The transcription start site of the mouse TREB5 gene was mapped to −15 bp upstream from the ATG initiation codon. Promoter analysis of serial deletion mutants revealed that the −142 bp upstream region is the minimum sequence to promote mouse TREB5 gene expression and that the −1.0 kb upstream region is required for full promoter activity. "," TREB5/hXBP-1/HTF is a basic region leucine zipper protein which binds to a cyclic AMP responsive element (CRE)-like element in both human T-cell leukemia virus type 1 and human major histocompatibility complex (MHC) class II genes. To analyze the structure and transcription regulation of the TREB5 gene, we isolated the mouse TREB5 gene and cDNA. The mouse TREB5 gene contains five exons and four introns and spans approximately 5 kb. The deduced amino acid sequence of mouse TREB5 exhibited 77% and 94% homology to human and rat TREB5, respectively. The b-zip structure is completely conserved in mouse, rat and human. Southern blot analysis of the mouse genomic DNA demonstrated that positive bands exactly coincide with those expected from sequences of the cloned genes, indicating that the mouse TREB5 gene is present as a single copy. The transcription start site of the mouse TREB5 gene was mapped to −15 bp upstream from the ATG initiation codon. Promoter analysis of serial deletion mutants revealed that the −142 bp upstream region is the minimum sequence to promote mouse TREB5 gene expression and that the −1.0 kb upstream region is required for full promoter activity. "
"23","10.1093/dnares/7.3.195","Sequence-based Structural Features between Kvlqt1 and Tapa1 on Mouse Chromosome 7F4/F5 Corresponding to the Beckwith-Wiedemann Syndrome Region on Human 11p15.5 : long-stretches of Unusually Well Conserved Intronic Sequences of Kvlqt1 between Mouse and Human","Hitomi Yatsuki,Hidemi Watanabe,Masahira Hattori,Keiichiro Joh,Hidenobu Soejima,Hiroshi Komoda,Zhenghan Xin,Xike Zhu,Ken Higashimoto,Masayo Nishimura,Shinobu Kuratomi,Hiroyuki Sasaki,Yoshiyuki Sakaki,Tsunehiro Mukai","NO","NO","NO","01 June 2000","genomic imprinting, mouse chromosome 7F4/F5, Lit1 ( Kvlqt1-AS ) , Mtr1, Tssc4"," Mouse chromosome 7F4/F5 is a syntenic locus of human 11p15.5 in which many imprinted genes are clustered. Transmission of aberrant human 11p15.5 or duplicated 11p causes Beckwith-Wiedemann syndrome (BWS) depending on which parent the chromosome is derived from. To analyze a syntenic mouse locus corresponding to human 11p15.5, mouse BAC contigs were constructed between Nap2 and Tapa1 , in which 390 kb was sequenced between Kvlqt1 and Tapa1 . An unexpected finding was that of highlyconserved intronic sequences of Kvlqt1 between mouse and human, and their homologies came up to at least 160 kb because the length of this gene extended to 350 kb, suggesting the possibilityof some functional constraint due to transcriptional and/or post-transcriptional regulation of this region. Manyexpressed sequence tags (ESTs) were mapped on this locus. Three genes, Lit1 ( Kvlqt1-AS ), Mtr1 and Tssc4 , were identified and characterized. Lit1 is an antisense-transcript of Kvlqt1 and paternally expressed and maternally methylated throughout the developmental stage. The position where Lit1 exists corresponded to a highly conserved region between mouse and human. This transcript extends at least 60 kb from downstream to upstream of exon 10 in Kvlqt1 . Tssc4 and Mtr1 carried putative open reading frames but neither was imprinted. Further characterization of this locus based on the sequence comparison between mouse and human will contribute valuable information towards resolving the mechanism of the occurrence of BWS and the associated childhood tumor. "," Mouse chromosome 7F4/F5 is a syntenic locus of human 11p15.5 in which many imprinted genes are clustered. Transmission of aberrant human 11p15.5 or duplicated 11p causes Beckwith-Wiedemann syndrome (BWS) depending on which parent the chromosome is derived from. To analyze a syntenic mouse locus corresponding to human 11p15.5, mouse BAC contigs were constructed between Nap2 and Tapa1 , in which 390 kb was sequenced between Kvlqt1 and Tapa1 . An unexpected finding was that of highlyconserved intronic sequences of Kvlqt1 between mouse and human, and their homologies came up to at least 160 kb because the length of this gene extended to 350 kb, suggesting the possibilityof some functional constraint due to transcriptional and/or post-transcriptional regulation of this region. Manyexpressed sequence tags (ESTs) were mapped on this locus. Three genes, Lit1 ( Kvlqt1-AS ), Mtr1 and Tssc4 , were identified and characterized. Lit1 is an antisense-transcript of Kvlqt1 and paternally expressed and maternally methylated throughout the developmental stage. The position where Lit1 exists corresponded to a highly conserved region between mouse and human. This transcript extends at least 60 kb from downstream to upstream of exon 10 in Kvlqt1 . Tssc4 and Mtr1 carried putative open reading frames but neither was imprinted. Further characterization of this locus based on the sequence comparison between mouse and human will contribute valuable information towards resolving the mechanism of the occurrence of BWS and the associated childhood tumor. "
"24","10.1093/dnares/7.3.207","A Novel Gene, DSCR5 , from the Distal Down Syndrome Critical Region on Chromosome 21q22.2","Takushi Togashi,Dong-Kug Choi,Todd D. Taylor,Yutaka Suzuki,Sumio Sugano,Masahira Hattori,Yoshiyuki Sakaki","NO","NO","NO","01 June 2000","cDNA cloning, Down syndrome, oligo-capping"," Based on a detailed sequence of the distal Down syndrome critical region (DSCR), we predicted and molecularly cloned a novel gene, designated DSCR5 . We determined the sequences of expressed sequence tags (ESTs) that almost matched the predicted cDNA sequence of DSCR5 . Northern blot analysis showed that DSCR5 is expressed in several tissues including the liver, skeletal muscle, heart, pancreas and testis. To determine the 5′-end of DSCR5 , the oligo-capping method was employed. Combining the EST sequence data and that from the oligo-capping experiments, we obtained the full-length cDNA sequence of DSCR5 . DSCR5 had at least four types of alternatively spliced variants. According to the number of exons, they could be classified into two subtypes: DSCR5α1 and DSCR5β . DSCR5α includes three splice variant subtypes, DSCR5α1 , α2 and α3 , which each has different first non-coding exon. In addition, the most abundantly isolated form, DSCR5α1 , shows microheterogeneity of the mRNA start site. Comparison of the sequences between the predicted cDNA and the molecularly cloned cDNA revealed that the computer programs had limited validity to correctly predict the terminal exons. Thus, molecular cloning should always be required to complement the inadequacy of the computer predictions. "," Based on a detailed sequence of the distal Down syndrome critical region (DSCR), we predicted and molecularly cloned a novel gene, designated DSCR5 . We determined the sequences of expressed sequence tags (ESTs) that almost matched the predicted cDNA sequence of DSCR5 . Northern blot analysis showed that DSCR5 is expressed in several tissues including the liver, skeletal muscle, heart, pancreas and testis. To determine the 5′-end of DSCR5 , the oligo-capping method was employed. Combining the EST sequence data and that from the oligo-capping experiments, we obtained the full-length cDNA sequence of DSCR5 . DSCR5 had at least four types of alternatively spliced variants. According to the number of exons, they could be classified into two subtypes: DSCR5α1 and DSCR5β . DSCR5α includes three splice variant subtypes, DSCR5α1 , α2 and α3 , which each has different first non-coding exon. In addition, the most abundantly isolated form, DSCR5α1 , shows microheterogeneity of the mRNA start site. Comparison of the sequences between the predicted cDNA and the molecularly cloned cDNA revealed that the computer programs had limited validity to correctly predict the terminal exons. Thus, molecular cloning should always be required to complement the inadequacy of the computer predictions. "
"25","10.1093/dnares/7.3.213","Analysis of Expressed Sequence Tags of Flower Buds in Lotus japonicus","Makoto Endo,Takao Kokubun,Yoshihito Takahata,Atsushi Higashitani,Satoshi Tabata,Masao Watanabe","NO","NO","NO","01 June 2000","Legume, Lotus japonicus, ESTs, flower bud, pollen-specific gene"," In order to study gene expression in a reproductive organ, we constructed a cDNA library of mature flower buds in Lotus japonicus , and characterized expressed sequence tags (ESTs) of 842 clones randomlyselected. The EST sequences were clustered into 718 non-redundant groups. From BLAST and FASTA search analyses of both protein and DNA databases, 58.5% of the EST groups showed significant sequence similarities to known genes. Several genes encoding these EST clones were identified as pollen-specific genes, such as pectin methylesterase, ascorbate oxidase, and polygalacturonase, and as homologous genes involved in pollen-pistil interaction. Comparison of these EST sequences with those derived from the whole plant of L. japonicus , revealed that 64.8% of EST sequences from the flower buds were not found in EST sequences of the whole plant. Taken together, the EST data from flower buds generated in this study is useful in dissecting gene expression in floral organ of L. japonicus . "," In order to study gene expression in a reproductive organ, we constructed a cDNA library of mature flower buds in Lotus japonicus , and characterized expressed sequence tags (ESTs) of 842 clones randomlyselected. The EST sequences were clustered into 718 non-redundant groups. From BLAST and FASTA search analyses of both protein and DNA databases, 58.5% of the EST groups showed significant sequence similarities to known genes. Several genes encoding these EST clones were identified as pollen-specific genes, such as pectin methylesterase, ascorbate oxidase, and polygalacturonase, and as homologous genes involved in pollen-pistil interaction. Comparison of these EST sequences with those derived from the whole plant of L. japonicus , revealed that 64.8% of EST sequences from the flower buds were not found in EST sequences of the whole plant. Taken together, the EST data from flower buds generated in this study is useful in dissecting gene expression in floral organ of L. japonicus . "
"26","10.1093/dnares/7.3.217","Structural Analysis of Arabidopsis thaliana Chromosome 3. II. Sequence Features of the 4,251,695 bp Regions Covered by 90 P1, TAC and BAC Clones","Takakazu Kaneko,Tomohiko Katoh,Shusei Sato,Yasukazu Nakamura,Erika Asamizu,Satoshi Tabata","NO","NO","NO","01 June 2000","Arabidopsis thaliana chromosome 3 , genomic sequence, P1 genomic library, TAC genomic library, gene prediction"," To deduce the entire sequence of the top arm of the Arabidopsis thaliana chromosome 3, the sequence determination was performed on a total of 90 P1, TAC and BAC clones chosen according to our sequencing strategy. Sequence features of the resulting 4,251,695 bp regions were analyzed with various computer programs for similarity search and gene modeling. As a result, a total of 941 potential protein-coding genes were identified. The average density of the genes identified was 1 gene per 4210 bp. Introns were observed in 73% of the genes, and the average number per gene and the average length of the introns were 3.6 and 159 bp, respectively. These sequence features are essentially identical to those of chromosomes 3and 5 in our previous reports. The regions also contained 14 tRNA genes when searched by similarity to reported tRNA genes and the tRNA scan-SE program. The sequence data and information on the potential genes are available through the World Wide Web database KAOS (Kazusa Arabidopsis data Opening Site) at Author Webpage . "," To deduce the entire sequence of the top arm of the Arabidopsis thaliana chromosome 3, the sequence determination was performed on a total of 90 P1, TAC and BAC clones chosen according to our sequencing strategy. Sequence features of the resulting 4,251,695 bp regions were analyzed with various computer programs for similarity search and gene modeling. As a result, a total of 941 potential protein-coding genes were identified. The average density of the genes identified was 1 gene per 4210 bp. Introns were observed in 73% of the genes, and the average number per gene and the average length of the introns were 3.6 and 159 bp, respectively. These sequence features are essentially identical to those of chromosomes 3and 5 in our previous reports. The regions also contained 14 tRNA genes when searched by similarity to reported tRNA genes and the tRNA scan-SE program. The sequence data and information on the potential genes are available through the World Wide Web database KAOS (Kazusa Arabidopsis data Opening Site) at Author Webpage . "
"27","10.1093/dnares/7.3.223","Generation of 10,154 Expressed Sequence Tags from a Leafy Gametophyte of a Marine Red Alga, Porphyra yezoensis","Itoshi Nikaido,Erika Asamizu,Maiko Nakajima,Yasukazu Nakamura,Naotsune Saga,Satoshi Tabata","NO","NO","NO","01 June 2000","Porphyra yezoensis, Rhodophyta, red alga, EST, codon usage"," A total of 10,154 5′-end expressed sequence tags (EST) were established from the normalized and size-selected cDNA libraries of a marine red alga, Porphyra yezoensis . Among the ESTs, 2140 were unique species, and the remaining 8014 were grouped into 1127 species. Database search of the 3267 non-redundant ESTs by BLAST algorithm showed that the sequences of 1080 species (33.1%) have similarity to those of registered genes from various organisms including higher plants, mammals, yeasts, and cyanobacteria,while 2187 (66.9%) are novel. Codon usage analysis in the coding regions of 101 non-redundant EST groups showing significant similarity to known genes indicated the higher GC contents at the third position of codons (79.4%) than the first (62.2%) and the second position (45.0%), suggesting that the genome hasbeen exposed to high GC pressure during evolution. The sequence data of individual ESTs are available at the web site Author Webpage . "," A total of 10,154 5′-end expressed sequence tags (EST) were established from the normalized and size-selected cDNA libraries of a marine red alga, Porphyra yezoensis . Among the ESTs, 2140 were unique species, and the remaining 8014 were grouped into 1127 species. Database search of the 3267 non-redundant ESTs by BLAST algorithm showed that the sequences of 1080 species (33.1%) have similarity to those of registered genes from various organisms including higher plants, mammals, yeasts, and cyanobacteria,while 2187 (66.9%) are novel. Codon usage analysis in the coding regions of 101 non-redundant EST groups showing significant similarity to known genes indicated the higher GC contents at the third position of codons (79.4%) than the first (62.2%) and the second position (45.0%), suggesting that the genome hasbeen exposed to high GC pressure during evolution. The sequence data of individual ESTs are available at the web site Author Webpage . "
"28","10.1093/dnares/7.3.229","Structurally and Functionally Distinct Mouse Hsp70 Family Members Mot-1 and Mot-2 Proteins are Encoded by Two Alleles","Sunil C. Kaul,Emma Duncan,Takashi Sugihara,Roger R. Reddel,Youji Mitsui,Renu Wadhwa","NO","NO","NO","01 June 2000","Mot-1, Mot-2, alleles"," The mouse mortalin proteins Mot-1 and Mot-2 differ by two amino acids in their carboxy-terminus. These proteins are differentially localized in the cell cytoplasm and have contrasting biological activities. The genetic relationship between Mot-1 and Mot-2 was deciphered by mouse family analyses. Mot-1 and Mot-2 segregated in F 1 and F 2 progeny, providing direct evidence that the two proteins are encoded by two alleles. "," The mouse mortalin proteins Mot-1 and Mot-2 differ by two amino acids in their carboxy-terminus. These proteins are differentially localized in the cell cytoplasm and have contrasting biological activities. The genetic relationship between Mot-1 and Mot-2 was deciphered by mouse family analyses. Mot-1 and Mot-2 segregated in F 1 and F 2 progeny, providing direct evidence that the two proteins are encoded by two alleles. "
"29","10.1093/dnares/7.3.233","The Human Homologue of Flamingo, EGFL2, Encodes a Brain-Expressed Large Cadherin-Like Protein with Epidermal Growth Factor-Like Domains, and Maps to Chromosome 1p13.3-p21.1","John B. Vincent,Jennifer Skaug,Stephen W. Scherer","NO","NO","NO","01 June 2000","NO","NO",""
